{"$schema":"http://json-schema.org/draft-07/schema#","title":"strategy-result-v1","type":"object","required":["contract_version","strategy_id","strategy_version","invocation_id","status","decision","signals","proposed_state","diagnostics"],"properties":{"contract_version":{"const":"1"},"strategy_id":{"type":"string"},"strategy_version":{"type":"string"},"invocation_id":{"type":"string","pattern":"^inv_"},"status":{"enum":["SIGNAL","NO_SIGNAL","ERROR"]},"decision":{"type":"object","required":["bias","confidence"],"properties":{"bias":{"enum":["LONG","SHORT","FLAT"]},"confidence":{"type":"number","minimum":0,"maximum":1}}},"signals":{"type":"array","items":{"type":"object","required":["kind","symbol"],"properties":{"kind":{"type":"string"},"symbol":{"type":"string"}}}},"proposed_state":{"type":"object"},"diagnostics":{"type":"object","required":["reason"],"properties":{"reason":{"type":"string"},"code":{"enum":["OK","VALIDATION","TIMEOUT","CANCELLED","OOM","PANIC","OUTPUT_TOO_LARGE","CONTRACT_MISMATCH"]},"logs":{"type":"array","items":{"type":"string"}}}}}}