{
  "contract_version": "1",
  "strategy_id": "sma-cross",
  "strategy_version": "0.1.0",
  "invocation_id": "inv_01J9Z6Q0M4T7V8X2B3C5D7E9F1",
  "status": "SIGNAL",
  "decision": {
    "bias": "LONG",
    "confidence": 0.62
  },
  "signals": [
    {
      "kind": "WASM_PROPOSAL",
      "symbol": "BTCUSDT"
    }
  ],
  "proposed_state": {
    "window": ["67200.0", "67234.5"],
    "last_bias": "LONG"
  },
  "diagnostics": {
    "reason": "short window crossed above long window",
    "code": "OK",
    "logs": []
  }
}
